id,bid,正文,头条文章url,原始图片url,视频url,位置,日期,工具,点赞数,评论数,评论,转发数,话题,@用户,完整日期
[af63b511c8],[5253c6894e],"毫无预兆地梦到我爸了
他带着小学时的我在除夕夜骑摩托，绕着大街小巷寻找着买东西
顺便露了一手很高难度的玩摩托技术——好离谱的情节，但梦里的我玩得很开心
现在03：45，我醒了，可耳边好像还有摩托的轰隆声
七升，是个好梦 ",[9b2d5b4678],[9b2d5b4678],[9b2d5b4678],,2024-05-24T03:52:34,微博轻享版,0,0,,0,,[9b2d5b4678],2024-05-24 03:52:34
[5143ebbf57],[e0d256340e],"我拒绝解释
我早该这么做
我早厌倦了怎么解释都是徒劳 ",[9b2d5b4678],[9b2d5b4678],[9b2d5b4678],,2024-05-23T00:26:04,微博轻享版,0,0,,0,,[9b2d5b4678],2024-05-23 00:26:04
[ab481d8717],[4431dacdfd],"之前好不容易把身体调整到能称得上健康
现在却连洗个澡都要三番两次停下来休息好久
真是不知道要说些什么了，好无奈啊七升 ",[9b2d5b4678],[9b2d5b4678],[9b2d5b4678],,2024-05-20T15:16:06,微博轻享版,0,1,,0,,[9b2d5b4678],2024-05-20 15:16:06
[e707190e15],[b67e74b03d],这几天很烦躁 ,[9b2d5b4678],[9b2d5b4678],[9b2d5b4678],,2024-05-17T16:11:10,微博轻享版,0,0,,0,,[9b2d5b4678],2024-05-17 16:11:10
[2a540b765b],[4012b89650],耳膜像破了洞的气球，不断发出嘶嘶漏气音，很烦人 ,[9b2d5b4678],[9b2d5b4678],[9b2d5b4678],,2024-05-15T02:18:42,微博轻享版,0,0,,0,,[9b2d5b4678],2024-05-15 02:18:42
[390eb186ce],[a9be4190f4],我喜欢一本正经又有点冷的幽默方式 ,[9b2d5b4678],[9b2d5b4678],[9b2d5b4678],,2024-05-12T18:23:16,微博轻享版,0,0,,0,,[9b2d5b4678],2024-05-12 18:23:16
[0b868c8846],[016cd85738],"的确是烦的，嗯
我已经烦恼了经常如此烦恼
哈！嵌套 ",[9b2d5b4678],[9b2d5b4678],[9b2d5b4678],,2024-05-11T17:50:14,微博轻享版,0,0,,0,,[9b2d5b4678],2024-05-11 17:50:14
[3eef211c08],[d4977e6aac],"可真有意思，一个虚拟人物竟然和我有那么相似的过去
过去的记忆大多是平淡冷漠的，而不平淡的那部分，又大部分是负面的
那些记忆片段，经常让因为一个引头而想起它们的我，先是怔愣，然后则必须要冷笑出来
不冷笑，便好像难以压制心底泛滥的情绪
七升，今天我又想起什么垃圾了呢
我记起小时候吃饭时， ...
全文",[9b2d5b4678],[9b2d5b4678],[9b2d5b4678],,2024-05-11T16:28:41,微博轻享版,0,0,,0,,[9b2d5b4678],2024-05-11 16:28:41
[ed5c7b9604],[983f379a4f],闭眼从22点躺到4点，困得呼吸憋闷，还是睡不着 ,[9b2d5b4678],[9b2d5b4678],[9b2d5b4678],,2024-05-11T04:02:35,微博轻享版,5,1,"[{""id"": ""[8ca07a6a12]"", ""created_at"": ""05-11"", ""source"": ""来自陕西"", ""user"": {""id"": ""[6862778095]"", ""screen_name"": ""[7b6f80791a]""}, ""text"": "" [抱抱]"", ""like_counts"": 5, ""liked"": false}]",0,,[9b2d5b4678],2024-05-11 04:02:35
[e475b42f4e],[f9b69cc193],"哦，七升，七升，可真是难受啊
胡乱抹了抹脸，拽拽鼻子
还是难受啊 ",[9b2d5b4678],[9b2d5b4678],[9b2d5b4678],,2024-05-06T13:33:54,微博轻享版,0,0,,0,,[9b2d5b4678],2024-05-06 13:33:54
[945abe8ff9],[61c499bbdf],我没有把头发掉完，很是欣慰 ,[9b2d5b4678],[9b2d5b4678],[9b2d5b4678],,2024-05-06T08:32:15,微博轻享版,0,0,,0,,[9b2d5b4678],2024-05-06 08:32:15
[4cbc2c5b4e],[a9c10e0ff1],"我终于将恶徒看完了
因为是顾云章的漫长人生，所以这「终于」二字用得是真情实感啊
但总觉得还差点什么，抓耳挠腮，几乎要痒到心里
结局很美好，美好得让我有点不适应
栖升，我大概和顾云章在这一点上是有一点相像的——对别人的好意感到不适，对好日子也十分不安
当我看到中途时，我就在想，等到了结 ...
全文",[9b2d5b4678],[9b2d5b4678],[9b2d5b4678],,2024-05-06T07:51:54,微博轻享版,0,0,,0,,[9b2d5b4678],2024-05-06 07:51:54
[bd72b34144],[352bf8a821],"梦里我是只老虎
秘密被暴露，为了帮人递消息，被发现后，被用剪刀一刀一刀剪碎了手腕，身上也被刻了许多伤痕
清醒后，明明是个梦，一时间竟然也抬不起手，好像还在惨烈的疼 ",[9b2d5b4678],[9b2d5b4678],[9b2d5b4678],,2024-05-03T20:25:05,微博轻享版,0,0,,0,,[9b2d5b4678],2024-05-03 20:25:05
[eb03c1c0c6],[2ab6464242],我疑心我是被疼醒的 ,[9b2d5b4678],[9b2d5b4678],[9b2d5b4678],,2024-04-30T23:42:15,微博轻享版,0,1,"[{""id"": ""[d44bb5166d]"", ""created_at"": ""05-01"", ""source"": ""来自陕西"", ""user"": {""id"": ""[6862778095]"", ""screen_name"": ""[7b6f80791a]""}, ""text"": ""你是哪里疼呢？要不要紧？ [抱抱]"", ""like_counts"": 0, ""liked"": false}]",0,,[9b2d5b4678],2024-04-30 23:42:15
[19f191a240],[3531d3007a],"韩棠惨，又无辜又惨，被强迫还是一点害人的心思都没有，最后被踢断脖子
苏顺清惨，被威胁完不成任务就要死，孤注一掷出卖干爹还是死了
叶崇义惨，本身精神不稳定，被情人搞得家破人亡还一心贴着凶手
李纯惨，自小被当傻狗养，只学会了怎么伺候人，说丢就丢，说转手就转手
李继安，虽然心狠手辣，根本算 ...
全文",[9b2d5b4678],[9b2d5b4678],[9b2d5b4678],,2024-04-30T15:41:10,微博轻享版,0,0,,0,,[9b2d5b4678],2024-04-30 15:41:10
[68647af6e0],[4cd998b4c5],我喜欢金小丰 ,[9b2d5b4678],[9b2d5b4678],[9b2d5b4678],,2024-04-30T14:48:51,微博轻享版,0,0,,0,,[9b2d5b4678],2024-04-30 14:48:51
[9b0bb77a5d],[b690300ca5],"每天五点多的时候，窗外的鸟群就会活跃起来，鸣声不断
高中时有段时间差不多也是这个时候起床，却没有注意过 ",[9b2d5b4678],[9b2d5b4678],[9b2d5b4678],,2024-04-30T05:53:43,微博轻享版,0,0,,0,,[9b2d5b4678],2024-04-30 05:53:43
[81bb998f56],[d2d42c890e],好难受 ,[9b2d5b4678],[9b2d5b4678],[9b2d5b4678],,2024-04-26T04:22:03,微博轻享版,0,0,,0,,[9b2d5b4678],2024-04-26 04:22:03
[65e3bc85e9],[289d2eecf8],"想起来确诊以前那个学期
走在路上真是时刻感觉自己要炸成一地碎尸
后来去了内蒙一趟好了点，不过也没有今晚这样冷淡到能用沉稳形容的心情
也许跟是夜晚出来有关实际上我也不知道自己现在的视力退化到什么地步了
自从厌恶人声和日光，已经很久没有在白天的时候外出，甚至清醒的时刻都很少
也无所谓了
很 ...
全文",[9b2d5b4678],[9b2d5b4678],[9b2d5b4678],,2024-04-24T20:57:23,微博轻享版,0,0,,0,,[9b2d5b4678],2024-04-24 20:57:23
[203f0b44f8],[47e243967d],"下了一趟楼，提回了晚饭
楼下变化真的好大，也有了夜市，有点像武科大封校以前的南门外了
没有多停留，甚至没有多看，没什么兴趣
和以前一样对太密集的人群有些稍微地烦
但和别人说一两句话的感觉还不赖 ",[9b2d5b4678],[9b2d5b4678],[9b2d5b4678],,2024-04-24T20:50:35,微博轻享版,8,1,"[{""id"": ""[6f7e5b969d]"", ""created_at"": ""04-25"", ""source"": ""来自陕西"", ""user"": {""id"": ""[6862778095]"", ""screen_name"": ""[7b6f80791a]""}, ""text"": ""孩子真棒👍，你又进步了，慢慢来，你一定可以突破自己的加油✊"", ""like_counts"": 8, ""liked"": false}]",0,,[9b2d5b4678],2024-04-24 20:50:35
[ebbed45eea],[2845a9d946],"这里其实挺靠近机场，经常能听到飞机破空的声音
我很小的时候，就常常有意无意地注意它们在晴朗蓝天拉长扩散的白絮尾线
不过我只有小学以及大学休学时，才有比较深刻的印象
至于其它阶段，初中大概的确被打击到有些自闭症状了，高中直接住外面，都没有什么余裕去观察飞机线
以前无知所以快乐，后面长大 ...
全文",[9b2d5b4678],[9b2d5b4678],[9b2d5b4678],,2024-04-24T01:47:25,微博轻享版,0,0,,0,,[9b2d5b4678],2024-04-24 01:47:25
[119c87b8f3],[d65b50bf21],"凌晨下了一趟楼，走了大概五六分钟吧，就失去了耐性
不冷不热，是我喜欢的微凉温度，因为是凌晨所以也没有几个人
如此适合随便走走的条件，却得不到应有的结果
七升，可见做事是需要外部和内部共同及格的
而我现在的心理显然还未及格
不过比起前段已经很好了
七升，事情的发展往往并不是线性的，不是简 ...
全文",[9b2d5b4678],[9b2d5b4678],[9b2d5b4678],,2024-04-24T01:09:35,微博轻享版,5,1,"[{""id"": ""[e71da94158]"", ""created_at"": ""04-24"", ""source"": ""来自陕西"", ""user"": {""id"": ""[6862778095]"", ""screen_name"": ""[7b6f80791a]""}, ""text"": ""孩子你真棒，能下去走几分钟就已经不错了，最起码你跨出第一步了，要坚持，循序渐进，慢慢来不急，最起码外面有清新的空气，看看花花草草对你会有帮助的，加油✊"", ""like_counts"": 4, ""liked"": false}]",0,,[9b2d5b4678],2024-04-24 01:09:35
[8433f23e2d],[f0f352daf0],真不舒服啊 ,[9b2d5b4678],[9b2d5b4678],[9b2d5b4678],,2024-04-15T06:08:13,微博轻享版,0,1,"[{""id"": ""[84d06549f1]"", ""created_at"": ""04-15"", ""source"": ""来自陕西"", ""user"": {""id"": ""[6862778095]"", ""screen_name"": ""[7b6f80791a]""}, ""text"": ""，懂你的所有不舒服，心疼宝贝，可怎么才能帮到你呢？扛不住的时候别忘了身边有爱你的人，每时每刻都在关注着你，痛在你身上，疼在我心里，给自己信心，我们一起努力，加油✊ [抱抱]"", ""like_counts"": 0, ""liked"": false}]",0,,[9b2d5b4678],2024-04-15 06:08:13
[477a384cea],[f770229f11],"和抖音之类的app比起来，B站还是大致能称为属于年轻人的地盘了
视频评论区表达与交换了大量古怪的，深沉的，逗乐的想法
今天有个人说他渴望全身心地臣服于另一个人
这种想要被管教被束缚被掌控的心态，现今意外还挺常见的，跟评的就有一大堆
DOM和SUB之类的小众圈子，因为互联网的存在，大家也不算陌 ...
全文",[9b2d5b4678],[9b2d5b4678],[9b2d5b4678],,2024-04-11T00:03:23,微博轻享版,0,0,,0,,[9b2d5b4678],2024-04-11 00:03:23
[6e663d22d2],[81219d8d2f],"我在难受些什么？
太老旧的话题
这感觉真不舒服啊
真不舒服 ",[9b2d5b4678],[9b2d5b4678],[9b2d5b4678],,2024-04-08T20:23:59,微博轻享版,0,0,,0,,[9b2d5b4678],2024-04-08 20:23:59
[faddc2258d],[bdb983dc17],感觉我要裂开了 ,[9b2d5b4678],[9b2d5b4678],[9b2d5b4678],,2024-04-07T20:08:46,微博轻享版,0,0,,0,,[9b2d5b4678],2024-04-07 20:08:46
[01af337a95],[9dd1bead1e],我讨厌小孩 ,[9b2d5b4678],[9b2d5b4678],[9b2d5b4678],,2024-04-07T19:31:37,微博轻享版,0,0,,0,,[9b2d5b4678],2024-04-07 19:31:37
[13578090cb],[a12711a007],人类离不开碳水化合物 ,[9b2d5b4678],[9b2d5b4678],[9b2d5b4678],,2024-04-04T12:41:06,微博轻享版,0,0,,0,,[9b2d5b4678],2024-04-04 12:41:06
[a5025dfbc5],[f654c6665f],好了，我又什么事都没有了 ,[9b2d5b4678],[9b2d5b4678],[9b2d5b4678],,2024-04-04T11:46:54,微博轻享版,7,1,"[{""id"": ""[00933407a4]"", ""created_at"": ""04-04"", ""source"": ""来自陕西"", ""user"": {""id"": ""[6862778095]"", ""screen_name"": ""[7b6f80791a]""}, ""text"": ""姨好开心，希望你痛苦能减少一点，越来越好！没事了，就多照顾自己的身体，好好爱自己，你已经很不容易了，相信自己会熬出头 [抱抱]"", ""like_counts"": 7, ""liked"": false}]",0,,[9b2d5b4678],2024-04-04 11:46:54
[28635760aa],[6c91683962],激素和递质让我感觉我的肠子正在断掉 ,[9b2d5b4678],[9b2d5b4678],[9b2d5b4678],,2024-04-04T11:03:17,微博轻享版,0,0,,0,,[9b2d5b4678],2024-04-04 11:03:17
[3bd4b00fce],[517d376e63],"我不知道我为什么想笑
我明明不开心 ",[9b2d5b4678],[9b2d5b4678],[9b2d5b4678],,2024-04-04T10:54:19,微博轻享版,0,0,,0,,[9b2d5b4678],2024-04-04 10:54:19
