id,bid,正文,头条文章url,原始图片url,视频url,位置,日期,工具,点赞数,评论数,评论,转发数,话题,@用户,完整日期
[ceb5b98216],[a57efd435b],"抑郁症
 
感觉他们忍耐到极限了，好不起来怎么办
爸妈已经让我停药了但是睡眠越来越不好了
怎么办啊他们好像也没意识到我有病，是因为他们曾经的童年遭遇生活压力导致他们精神上的疾病导致他们不能理解我现在所处的环境下抑郁的原因吗
感觉父母商人的一面就体现在一定要在周期内看到回报和收益 ...
全文",[9b2d5b4678],[9b2d5b4678],[9b2d5b4678],,2024-05-03T15:54:31,抑郁症超话,0,1,"[{""id"": ""[c4997c10d3]"", ""created_at"": ""20小时前"", ""source"": ""来自安徽"", ""user"": {""id"": ""[e4d75cb6a5]"", ""screen_name"": ""[790df35fe3]""}, ""text"": "" [抱抱]"", ""like_counts"": 0, ""liked"": false}]",0,,[9b2d5b4678],2024-05-03 15:54:31
[ef8e4d73dd],[f3a0a23b4c],"抑郁症
 
妈妈带我去做心理咨询，一个小时那个医生也没和我聊什么，说什么让我催眠放松感觉一点用都没有，我真的觉得自己活着就是在浪费妈妈的钱，一个小时一千两百块，妈妈还要骗我很便宜
我知道我们家出的起这个钱但是只要一花钱我就有负罪感，我真的不想看心理医生了。正常的心理咨询师 ...
全文",[9b2d5b4678],[9b2d5b4678],[9b2d5b4678],,2024-04-19T21:01:58,抑郁症超话,4,28,,0,,[9b2d5b4678],2024-04-19 21:01:58
